,AskMen,"
I’ve never had problems with freezing up in tough situations. In general, I’m a person with slightly higher than average anxiety. It’s annoying but it also kind-of feels like a superpower. Here’s why:

In high school chemistry class, I was working on a project that involved Bunsen burners. We were in groups of two. A team of two girls next to my station had a burner with an old rubber hose that was dry rotted and it suddenly burst into flames. They screamed and didn’t know what to do. Without hesitating, I just reached over and turned off the gas source to their burner. Problem solved. Later the teacher complimented my quick reaction. I’ve had several situations like this throughout my life. 

I feel like I always know what to do when shit hits the fan. I feel like doctor strange, I’ve already mentally seen a million scenarios in my mind from assault to robbery to car wrecks to you name it. I feel like hulk, “that’s my secret, I’m always anxious.” Because being in a bad situations just feels the same as every day of my life. 

Meeting someone new? Anxious. Big project at work? Anxious. Driving down the road? Anxious. It’s not a great help with losing my inhibitions in social situations but I guess everything has an upside, eh? I fit in well enough that it’s not a huge handicap in life, so it’s actually kind-of nice. So what’s your anxiety (or other) superpower?",t2_5zj2ison,False,,0,False,What’s your anxiety superpower?,[],r/AskMen,False,6,,0,False,t3_gfkwix,False,dark,0.94,,public,445,1,{},,False,[],,False,False,,{},,False,445,,False,,False,,[],{},,True,,1588934766.0,text,6,,,text,self.AskMen,False,"&lt;!-- SC_OFF --&gt;&lt;div class=""md""&gt;&lt;p&gt;I’ve never had problems with freezing up in tough situations. In general, I’m a person with slightly higher than average anxiety. It’s annoying but it also kind-of feels like a superpower. Here’s why:&lt;/p&gt;

&lt;p&gt;In high school chemistry class, I was working on a project that involved Bunsen burners. We were in groups of two. A team of two girls next to my station had a burner with an old rubber hose that was dry rotted and it suddenly burst into flames. They screamed and didn’t know what to do. Without hesitating, I just reached over and turned off the gas source to their burner. Problem solved. Later the teacher complimented my quick reaction. I’ve had several situations like this throughout my life. &lt;/p&gt;

&lt;p&gt;I feel like I always know what to do when shit hits the fan. I feel like doctor strange, I’ve already mentally seen a million scenarios in my mind from assault to robbery to car wrecks to you name it. I feel like hulk, “that’s my secret, I’m always anxious.” Because being in a bad situations just feels the same as every day of my life. &lt;/p&gt;

&lt;p&gt;Meeting someone new? Anxious. Big project at work? Anxious. Driving down the road? Anxious. It’s not a great help with losing my inhibitions in social situations but I guess everything has an upside, eh? I fit in well enough that it’s not a huge handicap in life, so it’s actually kind-of nice. So what’s your anxiety (or other) superpower?&lt;/p&gt;
&lt;/div&gt;&lt;!-- SC_ON --&gt;",,,,,False,False,False,False,False,"[{'giver_coin_reward': 0, 'subreddit_id': None, 'is_new': False, 'days_of_drip_extension': 0, 'coin_price': 50, 'id': 'award_02d9ab2c-162e-4c01-8438-317a016ed3d9', 'penny_donate': 0, 'coin_reward': 0, 'icon_url': 'https://i.redd.it/award_images/t5_22cerq/898sygoknoo41_TakeMyEnergy.png', 'days_of_premium': 0, 'icon_height': 2048, 'resized_icons': [{'url': 'https://preview.redd.it/award_images/t5_22cerq/898sygoknoo41_TakeMyEnergy.png?width=16&amp;height=16&amp;auto=webp&amp;s=92e96be1dbd278dc987fbd9acc1bd5078566f254', 'width': 16, 'height': 16}, {'url': 'https://preview.redd.it/award_images/t5_22cerq/898sygoknoo41_TakeMyEnergy.png?width=32&amp;height=32&amp;auto=webp&amp;s=83e14655f2b162b295f7d2c7058b9ad94cf8b73c', 'width': 32, 'height': 32}, {'url': 'https://preview.redd.it/award_images/t5_22cerq/898sygoknoo41_TakeMyEnergy.png?width=48&amp;height=48&amp;auto=webp&amp;s=83038a4d6181d3c8f5107dbca4ddb735ca6c2231', 'width': 48, 'height': 48}, {'url': 'https://preview.redd.it/award_images/t5_22cerq/898sygoknoo41_TakeMyEnergy.png?width=64&amp;height=64&amp;auto=webp&amp;s=3c4e39a7664d799ff50f32e9a3f96c3109d2e266', 'width': 64, 'height': 64}, {'url': 'https://preview.redd.it/award_images/t5_22cerq/898sygoknoo41_TakeMyEnergy.png?width=128&amp;height=128&amp;auto=webp&amp;s=390bf9706b8e1a6215716ebcf6363373f125c339', 'width': 128, 'height': 128}], 'icon_width': 2048, 'start_date': None, 'is_enabled': True, 'description': ""I'm in this with you."", 'end_date': None, 'subreddit_coin_reward': 0, 'count': 1, 'name': 'Take My Energy', 'icon_format': 'PNG', 'award_sub_type': 'GLOBAL', 'penny_price': 0, 'award_type': 'global'}]",[],False,False,False,False,,[],False,,,,t5_2s30g,,,,gfkwix,True,,-CuriousPanda-,,132,True,all_ads,False,[],False,,/r/AskMen/comments/gfkwix/whats_your_anxiety_superpower/,all_ads,False,https://www.reddit.com/r/AskMen/comments/gfkwix/whats_your_anxiety_superpower/,1884565,1588905966.0,1,,False,
,AskMen,"What are things a guy does, says, or thinks that show he loves a girl? What changes in a guy when he loves a certain person?",t2_57i12mrx,False,,0,False,How can you tell if a guy loves you?,[],r/AskMen,False,6,,0,False,t3_gfktpo,False,dark,0.91,,public,62,0,{},,False,[],,False,False,,{},,False,62,,False,,1588905838.0,,[],{},,True,,1588934445.0,text,6,,,text,self.AskMen,False,"&lt;!-- SC_OFF --&gt;&lt;div class=""md""&gt;&lt;p&gt;What are things a guy does, says, or thinks that show he loves a girl? What changes in a guy when he loves a certain person?&lt;/p&gt;
&lt;/div&gt;&lt;!-- SC_ON --&gt;",,,,,False,False,False,False,False,[],[],False,False,False,False,,[],False,,,,t5_2s30g,,,,gfktpo,True,,littlejackfruit23,,64,True,all_ads,False,[],False,,/r/AskMen/comments/gfktpo/how_can_you_tell_if_a_guy_loves_you/,all_ads,False,https://www.reddit.com/r/AskMen/comments/gfktpo/how_can_you_tell_if_a_guy_loves_you/,1884565,1588905645.0,0,,False,
,AskMen,,t2_16nn3h,False,,0,False,"Men who have a set of general life mentors, how did you find your mentors?",[],r/AskMen,False,6,,0,False,t3_gfknbh,False,dark,0.68,,public,3,0,{},,False,[],,False,False,,{},,False,3,,False,,False,,[],{},,True,,1588933724.0,text,6,,,text,self.AskMen,False,,,,,,False,True,False,False,False,[],[],False,False,False,False,,[],False,,,,t5_2s30g,,,,gfknbh,True,,_nonzerosum,,7,True,all_ads,False,[],False,,/r/AskMen/comments/gfknbh/men_who_have_a_set_of_general_life_mentors_how/,all_ads,False,https://www.reddit.com/r/AskMen/comments/gfknbh/men_who_have_a_set_of_general_life_mentors_how/,1884565,1588904924.0,0,,False,
,AskMen,,t2_4xt4cosd,False,,0,False,"If you could say anything to the men out there who take dance (ballet, tap, jazz, etc) what would you say?",[],r/AskMen,False,6,,0,False,t3_gfkmw4,False,dark,0.67,,public,2,0,{},,False,[],,False,False,,{},,False,2,,False,,False,,[],{},,True,,1588933678.0,text,6,,,text,self.AskMen,False,,,,,,False,False,False,False,False,[],[],False,False,False,False,,[],False,,,,t5_2s30g,,,,gfkmw4,True,,McCrysler,,24,True,all_ads,False,[],False,,/r/AskMen/comments/gfkmw4/if_you_could_say_anything_to_the_men_out_there/,all_ads,False,https://www.reddit.com/r/AskMen/comments/gfkmw4/if_you_could_say_anything_to_the_men_out_there/,1884565,1588904878.0,0,,False,
,AskMen,,t2_4y0vct01,False,,0,False,What’s the best thing to do while drinking alone?,[],r/AskMen,False,6,,0,False,t3_gfkecm,False,dark,0.76,,public,2,0,{},,False,[],,False,False,,{},,False,2,,False,,False,,[],{},,True,,1588932750.0,text,6,,,text,self.AskMen,False,,,,,,False,False,False,False,False,[],[],False,False,False,False,,[],False,,,,t5_2s30g,,,,gfkecm,True,,Freggy5,,31,True,all_ads,False,[],False,,/r/AskMen/comments/gfkecm/whats_the_best_thing_to_do_while_drinking_alone/,all_ads,False,https://www.reddit.com/r/AskMen/comments/gfkecm/whats_the_best_thing_to_do_while_drinking_alone/,1884565,1588903950.0,0,,False,
,AskMen,,t2_4j3d3y9z,False,,0,False,"What do you do when you’re trying to keep in touch with friends but responses are mixed (enthusiasm, polite replies or nothing)?",[],r/AskMen,False,6,,0,False,t3_gfjwa6,False,dark,0.89,,public,41,0,{},,False,[],,False,False,,{},,False,41,,False,,False,,[],{},,True,,1588930773.0,text,6,,,text,self.AskMen,False,,,,,,False,False,False,False,False,[],[],False,False,False,False,,[],False,,,,t5_2s30g,,,,gfjwa6,True,,BlueOctopotato,,27,True,all_ads,False,[],False,,/r/AskMen/comments/gfjwa6/what_do_you_do_when_youre_trying_to_keep_in_touch/,all_ads,False,https://www.reddit.com/r/AskMen/comments/gfjwa6/what_do_you_do_when_youre_trying_to_keep_in_touch/,1884565,1588901973.0,0,,False,
,AskMen,"As soon as i got done counting, yes",t2_25mp87em,False,,0,False,"If you saw 10 million fireflies, would you even believe your eyes? Why or why not?","[{'e': 'text', 't': 'ITT: White people'}]",r/AskMen,False,6,,0,False,t3_gfjp7a,False,dark,0.44,,public,0,0,{},,False,[],,False,False,,{},ITT: White people,False,0,,False,,False,,[],{},,True,,1588929997.0,richtext,6,,,text,self.AskMen,False,"&lt;!-- SC_OFF --&gt;&lt;div class=""md""&gt;&lt;p&gt;As soon as i got done counting, yes&lt;/p&gt;
&lt;/div&gt;&lt;!-- SC_ON --&gt;",,,,,False,True,False,False,False,[],[],False,False,False,False,,[],False,,,,t5_2s30g,,,,gfjp7a,True,,PopularSolid,,12,True,all_ads,False,[],False,,/r/AskMen/comments/gfjp7a/if_you_saw_10_million_fireflies_would_you_even/,all_ads,False,https://www.reddit.com/r/AskMen/comments/gfjp7a/if_you_saw_10_million_fireflies_would_you_even/,1884565,1588901197.0,0,,False,04dd20de-b82c-11e8-8213-0ea8c83b3baa
