,AskMen,,t2_461jmg09,False,,0,False,What type of girl do you refuse to date?,[],r/AskMen,False,6,,0,False,t3_gfjay4,False,dark,0.79,,public,23,0,{},,False,[],,False,False,,{},,False,23,,False,,False,,[],{},,True,,1588928468.0,text,6,,,text,self.AskMen,True,,,,,,False,False,False,False,False,[],[],False,False,False,False,,[],False,,,,t5_2s30g,,,,gfjay4,True,,Foxie93,,175,True,all_ads,False,[],False,,/r/AskMen/comments/gfjay4/what_type_of_girl_do_you_refuse_to_date/,all_ads,False,https://www.reddit.com/r/AskMen/comments/gfjay4/what_type_of_girl_do_you_refuse_to_date/,1884565,1588899668.0,0,,False,
,AskMen,"In early high school, I realized all those romantic movies and rom-coms put unrealistic expectations on you guys like how porn does for girls. But I've always wondered where you guys get your relationship ideals from!

Guys talk about the girl you wifey up, compared to others who are great but not endgame.  And I know you guys think about specific relationship things when you're single that you miss. Who doesn't? So when it's not sex related, where are those fantasies/thoughts/etc inspired from?

(If it wasn't absolutely obvious, I am woman, hi pls don't shun me~)",t2_5gff02k8,False,,0,False,Where do you guys get your romantic relationship ideals from?,[],r/AskMen,False,6,,0,False,t3_gfizeq,False,dark,0.57,,public,1,0,{},,False,[],,False,False,,{},,False,1,,False,,False,,[],{},,True,,1588927269.0,text,6,,,text,self.AskMen,False,"&lt;!-- SC_OFF --&gt;&lt;div class=""md""&gt;&lt;p&gt;In early high school, I realized all those romantic movies and rom-coms put unrealistic expectations on you guys like how porn does for girls. But I&amp;#39;ve always wondered where you guys get your relationship ideals from!&lt;/p&gt;

&lt;p&gt;Guys talk about the girl you wifey up, compared to others who are great but not endgame.  And I know you guys think about specific relationship things when you&amp;#39;re single that you miss. Who doesn&amp;#39;t? So when it&amp;#39;s not sex related, where are those fantasies/thoughts/etc inspired from?&lt;/p&gt;

&lt;p&gt;(If it wasn&amp;#39;t absolutely obvious, I am woman, hi pls don&amp;#39;t shun me~)&lt;/p&gt;
&lt;/div&gt;&lt;!-- SC_ON --&gt;",,,,,False,True,False,False,False,[],[],False,False,False,False,,[],False,,,,t5_2s30g,,,,gfizeq,True,,throwaway-195353,,21,True,all_ads,False,[],False,,/r/AskMen/comments/gfizeq/where_do_you_guys_get_your_romantic_relationship/,all_ads,False,https://www.reddit.com/r/AskMen/comments/gfizeq/where_do_you_guys_get_your_romantic_relationship/,1884565,1588898469.0,0,,False,
,AskMen,"I feel like in my early 20s I would never. But now in my early 30s. After the first 6 months, at least once every hour.",t2_4qzgxkka,False,,0,False,How often do you fart around your SO?,[],r/AskMen,False,6,,0,False,t3_gfis85,False,dark,0.57,,public,1,0,{},,False,[],,False,False,,{},,False,1,,False,,False,,[],{},,True,,1588926558.0,text,6,,,text,self.AskMen,False,"&lt;!-- SC_OFF --&gt;&lt;div class=""md""&gt;&lt;p&gt;I feel like in my early 20s I would never. But now in my early 30s. After the first 6 months, at least once every hour.&lt;/p&gt;
&lt;/div&gt;&lt;!-- SC_ON --&gt;",,,,,False,True,False,False,False,[],[],False,False,False,False,,[],False,,,,t5_2s30g,,,,gfis85,True,,lsdevto,,23,True,all_ads,False,[],False,,/r/AskMen/comments/gfis85/how_often_do_you_fart_around_your_so/,all_ads,False,https://www.reddit.com/r/AskMen/comments/gfis85/how_often_do_you_fart_around_your_so/,1884565,1588897758.0,0,,False,
,AskMen,"Yes, yes, besides quarantining",t2_jvala,False,,0,False,"Punk and Emo men of the early 2000s, what are your hobbies and interests now?","[{'e': 'text', 't': 'Cheer Up, Emo Kid!'}]",r/AskMen,False,6,fq,0,False,t3_gfiqor,False,dark,0.67,#eb3305,public,2,0,{},f17b2dd0-cd16-11e1-b564-12313d051e91,False,[],,False,False,,{},"Cheer Up, Emo Kid!",False,2,,False,,False,female,"[{'e': 'text', 't': 'Female [30-35]'}, {'a': ':karma:', 'e': 'emoji', 'u': 'https://emoji.redditmedia.com/dgnf69ls1guz_t5_3nqvj/karma'}]",{},,True,,1588926397.0,richtext,6,,,richtext,self.AskMen,False,"&lt;!-- SC_OFF --&gt;&lt;div class=""md""&gt;&lt;p&gt;Yes, yes, besides quarantining&lt;/p&gt;
&lt;/div&gt;&lt;!-- SC_ON --&gt;",,,,,False,False,False,False,False,[],[],False,False,False,False,Female [30-35]:karma:,[],False,,,,t5_2s30g,,,#c1d4e2,gfiqor,True,,diamondeyes7,,19,True,all_ads,False,[],False,light,/r/AskMen/comments/gfiqor/punk_and_emo_men_of_the_early_2000s_what_are_your/,all_ads,False,https://www.reddit.com/r/AskMen/comments/gfiqor/punk_and_emo_men_of_the_early_2000s_what_are_your/,1884565,1588897597.0,0,,False,c0f6e744-153b-11e3-8f80-12313d223dbc
,AskMen,,t2_450cdops,False,,0,False,Have you ever been infatuated with a girl you never met (from online) and how did you address it?,[],r/AskMen,False,6,,0,False,t3_gfiofn,False,dark,0.63,,public,2,0,{},,False,[],,False,False,,{},,False,2,,False,,False,,[],{},,True,,1588926166.0,text,6,,,text,self.AskMen,False,,,,,,False,True,False,False,False,[],[],False,False,False,False,,[],False,,,,t5_2s30g,,,,gfiofn,True,,xxbalawyiii,,19,True,all_ads,False,[],False,,/r/AskMen/comments/gfiofn/have_you_ever_been_infatuated_with_a_girl_you/,all_ads,False,https://www.reddit.com/r/AskMen/comments/gfiofn/have_you_ever_been_infatuated_with_a_girl_you/,1884565,1588897366.0,0,,False,
,AskMen,"General consensus is that there is something wrong with me because I like sitting next to my partner.
Edit2 I think people are misinterpreting ""eating out"" hence the NSFW responses hahahaha",t2_2bugxayp,False,,0,False,"When eating out, how do you prefer to sit with your partner? Across from each other or side by side?",[],r/AskMen,False,6,,0,False,t3_gfibt9,False,dark,0.86,,public,22,0,{},,False,[],,False,False,,{},,False,22,,False,,1588914632.0,,[],{},,True,,1588924897.0,text,6,,,text,self.AskMen,False,"&lt;!-- SC_OFF --&gt;&lt;div class=""md""&gt;&lt;p&gt;General consensus is that there is something wrong with me because I like sitting next to my partner.
Edit2 I think people are misinterpreting &amp;quot;eating out&amp;quot; hence the NSFW responses hahahaha&lt;/p&gt;
&lt;/div&gt;&lt;!-- SC_ON --&gt;",,,,,False,False,False,False,False,[],[],False,False,False,False,,[],False,,,,t5_2s30g,,,,gfibt9,True,,chubs03,,55,True,all_ads,False,[],False,,/r/AskMen/comments/gfibt9/when_eating_out_how_do_you_prefer_to_sit_with/,all_ads,False,https://www.reddit.com/r/AskMen/comments/gfibt9/when_eating_out_how_do_you_prefer_to_sit_with/,1884565,1588896097.0,0,,False,
,AskMen,,t2_174yxb,False,,0,False,How do you suppress your need for love and affection?,[],r/AskMen,False,6,,0,False,t3_gfial0,False,dark,0.5,,public,0,0,{},,False,[],,False,False,,{},,False,0,,False,,False,,[],{},,True,,1588924782.0,text,6,,,text,self.AskMen,False,,,,,,False,True,False,False,False,[],[],False,False,False,False,,[],False,,,,t5_2s30g,,,,gfial0,True,,YourBoySugoi,,79,True,all_ads,False,[],False,,/r/AskMen/comments/gfial0/how_do_you_suppress_your_need_for_love_and/,all_ads,False,https://www.reddit.com/r/AskMen/comments/gfial0/how_do_you_suppress_your_need_for_love_and/,1884565,1588895982.0,0,,False,
,AskMen,,t2_5z6p9qar,False,,0,False,"Men of reddit, have you ever been obsessed with someone you can’t have? How did you overcome it?",[],r/AskMen,False,6,,0,False,t3_gfi0cy,False,dark,0.78,,public,10,0,{},,False,[],,False,False,,{},,False,10,,False,,False,,[],{},,True,,1588923764.0,text,6,,,text,self.AskMen,False,,,,,,False,False,False,False,False,[],[],False,False,False,False,,[],False,,,,t5_2s30g,,,,gfi0cy,True,,nycfunin,,18,True,all_ads,False,[],False,,/r/AskMen/comments/gfi0cy/men_of_reddit_have_you_ever_been_obsessed_with/,all_ads,False,https://www.reddit.com/r/AskMen/comments/gfi0cy/men_of_reddit_have_you_ever_been_obsessed_with/,1884565,1588894964.0,0,,False,
,AskMen,,t2_16f2hb9r,False,,0,False,"In your opinion, what is the greatest snack of all time?",[],r/AskMen,False,6,,0,False,t3_gfhszq,False,dark,0.67,,public,3,0,{},,False,[],,False,False,,{},,False,3,,False,,False,,[],{},,True,,1588923074.0,text,6,,,text,self.AskMen,False,,,,,,False,False,False,False,False,[],[],False,False,False,False,,[],False,,,,t5_2s30g,,,,gfhszq,True,,YaboiDC3,,29,True,all_ads,False,[],False,,/r/AskMen/comments/gfhszq/in_your_opinion_what_is_the_greatest_snack_of_all/,all_ads,False,https://www.reddit.com/r/AskMen/comments/gfhszq/in_your_opinion_what_is_the_greatest_snack_of_all/,1884565,1588894274.0,0,,False,
,AskMen,"What you learned about yourself, love, loss, what you want, what you don’t want",t2_iozcw,False,,0,False,What have you learned after your first few serious romantic relationships?,[],r/AskMen,False,6,,0,False,t3_gfhopu,False,dark,0.98,,public,1100,0,{},,False,[],,False,False,,{},,False,1100,,False,,False,,[],{},,True,,1588922652.0,text,6,,,text,self.AskMen,True,"&lt;!-- SC_OFF --&gt;&lt;div class=""md""&gt;&lt;p&gt;What you learned about yourself, love, loss, what you want, what you don’t want&lt;/p&gt;
&lt;/div&gt;&lt;!-- SC_ON --&gt;",,,,,False,False,False,False,False,[],[],False,False,False,False,,[],False,,,,t5_2s30g,,,,gfhopu,True,,penguinchange,,567,True,all_ads,False,[],False,,/r/AskMen/comments/gfhopu/what_have_you_learned_after_your_first_few/,all_ads,False,https://www.reddit.com/r/AskMen/comments/gfhopu/what_have_you_learned_after_your_first_few/,1884565,1588893852.0,0,,False,
,AskMen,"I've had plenty of regrets in my life, but I can always look back to one specific one that completely changed my life. What are the biggest regrets you guys can think back on?",t2_45pdsjmj,False,,0,False,What is your greatest regret?,[],r/AskMen,False,6,,0,False,t3_gfh83r,False,dark,0.67,,public,2,0,{},,False,[],,False,False,,{},,False,2,,False,,False,,[],{},,True,,1588921036.0,text,6,,,text,self.AskMen,False,"&lt;!-- SC_OFF --&gt;&lt;div class=""md""&gt;&lt;p&gt;I&amp;#39;ve had plenty of regrets in my life, but I can always look back to one specific one that completely changed my life. What are the biggest regrets you guys can think back on?&lt;/p&gt;
&lt;/div&gt;&lt;!-- SC_ON --&gt;",,,,,False,True,False,False,False,[],[],False,False,False,False,,[],False,,,,t5_2s30g,,,,gfh83r,True,,phattee2,,13,True,all_ads,False,[],False,,/r/AskMen/comments/gfh83r/what_is_your_greatest_regret/,all_ads,False,https://www.reddit.com/r/AskMen/comments/gfh83r/what_is_your_greatest_regret/,1884565,1588892236.0,0,,False,
,AskMen,"Hey, I am a 20 year old dude coming on 21 soon. My mates can easily grow facial hair, but for me it seems I can only grow a faint moustache and wispies on the chin only. It seriously makes me look like a 16 year old just hitting puberty.

My question, is there anyway I can stimulate and speed up the process of facial hair growth. It would be bliss if I could have a good beard. Also, I do realize this still could be late puberty or even a genetic thing, but is there anything I can possibly do? Cheers.",t2_3x5t336a,False,,0,False,How can I grow facial hair and/or stimulate growth?,[],r/AskMen,False,6,,0,False,t3_gfh5og,False,dark,0.81,,public,12,0,{},,False,[],,False,False,,{},,False,12,,False,,False,,[],{},,True,,1588920808.0,text,6,,,text,self.AskMen,False,"&lt;!-- SC_OFF --&gt;&lt;div class=""md""&gt;&lt;p&gt;Hey, I am a 20 year old dude coming on 21 soon. My mates can easily grow facial hair, but for me it seems I can only grow a faint moustache and wispies on the chin only. It seriously makes me look like a 16 year old just hitting puberty.&lt;/p&gt;

&lt;p&gt;My question, is there anyway I can stimulate and speed up the process of facial hair growth. It would be bliss if I could have a good beard. Also, I do realize this still could be late puberty or even a genetic thing, but is there anything I can possibly do? Cheers.&lt;/p&gt;
&lt;/div&gt;&lt;!-- SC_ON --&gt;",,,,,False,False,False,False,False,[],[],False,False,False,False,,[],False,,,,t5_2s30g,,,,gfh5og,True,,PinkPantha25,,41,True,all_ads,False,[],False,,/r/AskMen/comments/gfh5og/how_can_i_grow_facial_hair_andor_stimulate_growth/,all_ads,False,https://www.reddit.com/r/AskMen/comments/gfh5og/how_can_i_grow_facial_hair_andor_stimulate_growth/,1884565,1588892008.0,0,,False,
,AskMen,except for my mum,t2_5pyffzgr,False,,0,False,What is something or someone you feel pity towards?,[],r/AskMen,False,6,,0,False,t3_gfh5e0,False,dark,0.81,,public,3,0,{},,False,[],,False,False,,{},,False,3,,False,,False,,[],{},,True,,1588920780.0,text,6,,,text,self.AskMen,False,"&lt;!-- SC_OFF --&gt;&lt;div class=""md""&gt;&lt;p&gt;except for my mum&lt;/p&gt;
&lt;/div&gt;&lt;!-- SC_ON --&gt;",,,,,False,False,False,False,False,[],[],False,False,False,False,,[],False,,,,t5_2s30g,,,,gfh5e0,True,,Illidan_Stormrage4,,9,True,all_ads,False,[],False,,/r/AskMen/comments/gfh5e0/what_is_something_or_someone_you_feel_pity_towards/,all_ads,False,https://www.reddit.com/r/AskMen/comments/gfh5e0/what_is_something_or_someone_you_feel_pity_towards/,1884565,1588891980.0,0,,False,
,AskMen,"By the way, thank you for your service.",t2_5rmtxqnl,False,,0,False,"Men who served in the armed forces, what’s a cool story of how someone showed appreciation for your service?",[],r/AskMen,False,6,,0,False,t3_gfh3ge,False,dark,0.43,,public,0,0,{},,False,[],,False,False,,{},,False,0,,False,,False,,[],{},,True,,1588920607.0,text,6,,,text,self.AskMen,False,"&lt;!-- SC_OFF --&gt;&lt;div class=""md""&gt;&lt;p&gt;By the way, thank you for your service.&lt;/p&gt;
&lt;/div&gt;&lt;!-- SC_ON --&gt;",,,,,False,True,False,False,False,[],[],False,False,False,False,,[],False,,,,t5_2s30g,,,,gfh3ge,True,,DaydreamingMister,,4,True,all_ads,False,[],False,,/r/AskMen/comments/gfh3ge/men_who_served_in_the_armed_forces_whats_a_cool/,all_ads,False,https://www.reddit.com/r/AskMen/comments/gfh3ge/men_who_served_in_the_armed_forces_whats_a_cool/,1884565,1588891807.0,0,,False,
,AskMen,I'm asking.... For a friend....,t2_5n4fdoi8,False,,0,False,"Have you already took someone out the friendzone and if yes, why, what happened ?",[],r/AskMen,False,6,,0,False,t3_gfgzy6,False,dark,0.67,,public,3,0,{},,False,[],,False,False,,{},,False,3,,False,,False,,[],{},,True,,1588920262.0,text,6,,,text,self.AskMen,False,"&lt;!-- SC_OFF --&gt;&lt;div class=""md""&gt;&lt;p&gt;I&amp;#39;m asking.... For a friend....&lt;/p&gt;
&lt;/div&gt;&lt;!-- SC_ON --&gt;",,,,,False,False,False,False,False,[],[],False,False,False,False,,[],False,,,,t5_2s30g,,,,gfgzy6,True,,scoubisalami,,24,True,all_ads,False,[],False,,/r/AskMen/comments/gfgzy6/have_you_already_took_someone_out_the_friendzone/,all_ads,False,https://www.reddit.com/r/AskMen/comments/gfgzy6/have_you_already_took_someone_out_the_friendzone/,1884565,1588891462.0,0,,False,
,AskMen,,t2_48jiab4b,False,,0,False,What’s the meanest “prank” or “joke” a girl played on you?,[],r/AskMen,False,6,,0,False,t3_gfgxrq,False,dark,0.71,,public,3,0,{},,False,[],,False,False,,{},,False,3,,False,,False,,[],{},,True,,1588920052.0,text,6,,,text,self.AskMen,False,,,,,,False,False,False,False,False,[],[],False,False,False,False,,[],False,,,,t5_2s30g,,,,gfgxrq,True,,Bone_Her_Sauce,,12,True,all_ads,False,[],False,,/r/AskMen/comments/gfgxrq/whats_the_meanest_prank_or_joke_a_girl_played_on/,all_ads,False,https://www.reddit.com/r/AskMen/comments/gfgxrq/whats_the_meanest_prank_or_joke_a_girl_played_on/,1884565,1588891252.0,0,,False,
,AskMen,,t2_50xmlzay,False,,0,False,How do you know if a girl is good for you? Is it rare to find a good girl?,[],r/AskMen,False,6,,0,False,t3_gfgwnw,False,dark,0.67,,public,2,0,{},,False,[],,False,False,,{},,False,2,,False,,False,,[],{},,True,,1588919944.0,text,6,,,text,self.AskMen,False,,,,,,False,False,False,False,False,[],[],False,False,False,False,,[],False,,,,t5_2s30g,,,,gfgwnw,True,,thruuaaway,,13,True,all_ads,False,[],False,,/r/AskMen/comments/gfgwnw/how_do_you_know_if_a_girl_is_good_for_you_is_it/,all_ads,False,https://www.reddit.com/r/AskMen/comments/gfgwnw/how_do_you_know_if_a_girl_is_good_for_you_is_it/,1884565,1588891144.0,0,,False,
,AskMen,Or just in general what would make you feel that way?,t2_534z5x82,False,,0,False,When was a time that you felt jealous in a relationship?,[],r/AskMen,False,6,,0,False,t3_gfgvlu,False,dark,0.6,,public,1,0,{},,False,[],,False,False,,{},,False,1,,False,,False,,[],{},,True,,1588919838.0,text,6,,,text,self.AskMen,False,"&lt;!-- SC_OFF --&gt;&lt;div class=""md""&gt;&lt;p&gt;Or just in general what would make you feel that way?&lt;/p&gt;
&lt;/div&gt;&lt;!-- SC_ON --&gt;",,,,,False,True,False,False,False,[],[],False,False,False,False,,[],False,,,,t5_2s30g,,,,gfgvlu,True,,Chicksunny,,2,True,all_ads,False,[],False,,/r/AskMen/comments/gfgvlu/when_was_a_time_that_you_felt_jealous_in_a/,all_ads,False,https://www.reddit.com/r/AskMen/comments/gfgvlu/when_was_a_time_that_you_felt_jealous_in_a/,1884565,1588891038.0,0,,False,
,AskMen,I’ve read a total of 12 books already and I’m bored,t2_653mlmpk,False,,0,False,"Fellow Men of Reddit, what book(s) are you currently reading during the quarantine?",[],r/AskMen,False,6,,0,False,t3_gfgtrs,False,dark,0.62,#83acfa,public,3,0,{},ea22c17e-cd16-11e1-845d-12313b0ce1e2,False,[],,False,False,,{},,False,3,,False,,False,male,"[{'e': 'text', 't': 'Male'}]",{},,True,,1588919655.0,text,6,,,richtext,self.AskMen,False,"&lt;!-- SC_OFF --&gt;&lt;div class=""md""&gt;&lt;p&gt;I’ve read a total of 12 books already and I’m bored&lt;/p&gt;
&lt;/div&gt;&lt;!-- SC_ON --&gt;",,,,,False,False,False,False,False,[],[],False,False,False,False,Male,[],False,,,,t5_2s30g,,,,gfgtrs,True,,festival-papi,,34,True,all_ads,False,[],False,light,/r/AskMen/comments/gfgtrs/fellow_men_of_reddit_what_books_are_you_currently/,all_ads,False,https://www.reddit.com/r/AskMen/comments/gfgtrs/fellow_men_of_reddit_what_books_are_you_currently/,1884565,1588890855.0,0,,False,
,AskMen,,t2_zm14g,False,,0,False,"Bros who broke the ""bro code"" with friend's ex, why did you do it? What happened afterwards? Are you still friends?",[],r/AskMen,False,6,,0,False,t3_gfggf0,False,dark,0.54,,public,1,0,{},,False,[],,False,False,,{},,False,1,,False,,False,,[],{},,True,,1588918392.0,text,6,,,text,self.AskMen,False,,,,,,False,True,False,False,False,[],[],False,False,False,False,,[],False,,,,t5_2s30g,,,,gfggf0,True,,Billy_The_Kidd,,27,True,all_ads,False,[],False,,/r/AskMen/comments/gfggf0/bros_who_broke_the_bro_code_with_friends_ex_why/,all_ads,False,https://www.reddit.com/r/AskMen/comments/gfggf0/bros_who_broke_the_bro_code_with_friends_ex_why/,1884565,1588889592.0,0,,False,
,AskMen,No I won’t be quarantine cutting but my hair is long enough I will need a cut when this is all over.,t2_4x64paen,False,,0,False,What’s your favourite haircut you’ve had?,[],r/AskMen,False,6,,0,False,t3_gfgdzq,False,dark,0.4,,public,0,0,{},,False,[],,False,False,,{},,False,0,,False,,False,,[],{},,True,,1588918169.0,text,6,,,text,self.AskMen,False,"&lt;!-- SC_OFF --&gt;&lt;div class=""md""&gt;&lt;p&gt;No I won’t be quarantine cutting but my hair is long enough I will need a cut when this is all over.&lt;/p&gt;
&lt;/div&gt;&lt;!-- SC_ON --&gt;",,,,,False,True,False,False,False,[],[],False,False,False,False,,[],False,,,,t5_2s30g,,,,gfgdzq,True,,2007scenequeen,,11,True,all_ads,False,[],False,,/r/AskMen/comments/gfgdzq/whats_your_favourite_haircut_youve_had/,all_ads,False,https://www.reddit.com/r/AskMen/comments/gfgdzq/whats_your_favourite_haircut_youve_had/,1884565,1588889369.0,0,,False,
,AskMen,"Rather than at what age did you *have* your first relationship, when did you feel ready to be in one? To take on the responsibility and work, as well as opening yourself up to vulnerability and intimacy? Was there a specific experience or thought that made you have that realization?",t2_63vtbc2o,False,,0,False,At what age did you realize you were ready for a relationship?,[],r/AskMen,False,6,,0,False,t3_gfg81t,False,dark,0.4,,public,0,0,{},,False,[],,False,False,,{},,False,0,,False,,False,,[],{},,True,,1588917636.0,text,6,,,text,self.AskMen,False,"&lt;!-- SC_OFF --&gt;&lt;div class=""md""&gt;&lt;p&gt;Rather than at what age did you &lt;em&gt;have&lt;/em&gt; your first relationship, when did you feel ready to be in one? To take on the responsibility and work, as well as opening yourself up to vulnerability and intimacy? Was there a specific experience or thought that made you have that realization?&lt;/p&gt;
&lt;/div&gt;&lt;!-- SC_ON --&gt;",,,,,False,True,False,False,False,[],[],False,False,False,False,,[],False,,,,t5_2s30g,,,,gfg81t,True,,torturedartistclub,,21,True,all_ads,False,[],False,,/r/AskMen/comments/gfg81t/at_what_age_did_you_realize_you_were_ready_for_a/,all_ads,False,https://www.reddit.com/r/AskMen/comments/gfg81t/at_what_age_did_you_realize_you_were_ready_for_a/,1884565,1588888836.0,0,,False,
,AskMen,,t2_174yxb,False,,0,False,When did you stop believing you were unattractive to women?,[],r/AskMen,False,6,,0,False,t3_gffyp1,False,dark,0.77,,public,22,0,{},,False,[],,False,False,,{},,False,22,,False,,False,,[],{},,True,,1588916771.0,text,6,,,text,self.AskMen,False,,,,,,False,False,False,False,False,[],[],False,False,False,False,,[],False,,,,t5_2s30g,,,,gffyp1,True,,YourBoySugoi,,175,True,all_ads,False,[],False,,/r/AskMen/comments/gffyp1/when_did_you_stop_believing_you_were_unattractive/,all_ads,False,https://www.reddit.com/r/AskMen/comments/gffyp1/when_did_you_stop_believing_you_were_unattractive/,1884565,1588887971.0,0,,False,
,AskMen,"I (F) have a high sex drive but am horrible at initiating. My ""way"" is straightforward and I usually say ""let's have sex"" or something lame along those lines. I get nervous trying to initiate in other ways, like just going down on him without notice, or grabbing his dick and whatnot. So tell me, men, what would you like?",t2_b3p53mk,False,,0,False,How do you want your SO to initiate sex?,[],r/AskMen,False,6,,0,False,t3_gffy08,False,dark,0.76,,public,11,0,{},,False,[],,False,False,,{},,False,11,,False,,False,,[],{},,True,,1588916702.0,text,3,,,text,self.AskMen,False,"&lt;!-- SC_OFF --&gt;&lt;div class=""md""&gt;&lt;p&gt;I (F) have a high sex drive but am horrible at initiating. My &amp;quot;way&amp;quot; is straightforward and I usually say &amp;quot;let&amp;#39;s have sex&amp;quot; or something lame along those lines. I get nervous trying to initiate in other ways, like just going down on him without notice, or grabbing his dick and whatnot. So tell me, men, what would you like?&lt;/p&gt;
&lt;/div&gt;&lt;!-- SC_ON --&gt;",,,,,False,False,False,False,True,[],[],False,False,False,False,,[],False,,,,t5_2s30g,,,,gffy08,True,,notwhatuexpected,,33,True,promo_adult_nsfw,False,[],False,,/r/AskMen/comments/gffy08/how_do_you_want_your_so_to_initiate_sex/,all_ads,False,https://www.reddit.com/r/AskMen/comments/gffy08/how_do_you_want_your_so_to_initiate_sex/,1884565,1588887902.0,0,,False,
,AskMen,"pizza boxes, clothes, etc everywhere",t2_2spnd4e3,False,,0,False,What are some good cleaning tips for those of us (myself included) that are animals?,[],r/AskMen,False,6,,0,False,t3_gffv1q,False,dark,0.43,,public,0,0,{},,False,[],,False,False,,{},,False,0,,False,,False,,[],{},,True,,1588916435.0,text,6,,,text,self.AskMen,False,"&lt;!-- SC_OFF --&gt;&lt;div class=""md""&gt;&lt;p&gt;pizza boxes, clothes, etc everywhere&lt;/p&gt;
&lt;/div&gt;&lt;!-- SC_ON --&gt;",,,,,False,True,False,False,False,[],[],False,False,False,False,,[],False,,,,t5_2s30g,,,,gffv1q,True,,matthewo98,,8,True,all_ads,False,[],False,,/r/AskMen/comments/gffv1q/what_are_some_good_cleaning_tips_for_those_of_us/,all_ads,False,https://www.reddit.com/r/AskMen/comments/gffv1q/what_are_some_good_cleaning_tips_for_those_of_us/,1884565,1588887635.0,0,,False,
,AskMen,"I'm not a touchy-feely type of guy and my personal space bubble is bigger than most dudes, idk why but girls think my hair is public property or something.",t2_181seakp,False,,0,False,How do I stop a girl from getting touchy with me without looking like a prick?,[],r/AskMen,False,6,,0,False,t3_gffpv3,False,dark,0.5,,public,0,0,{},,False,[],,False,False,,{},,False,0,,False,,False,,[],{},,True,,1588915967.0,text,6,,,text,self.AskMen,False,"&lt;!-- SC_OFF --&gt;&lt;div class=""md""&gt;&lt;p&gt;I&amp;#39;m not a touchy-feely type of guy and my personal space bubble is bigger than most dudes, idk why but girls think my hair is public property or something.&lt;/p&gt;
&lt;/div&gt;&lt;!-- SC_ON --&gt;",,,,,False,True,False,False,False,[],[],False,False,False,False,,[],False,,,,t5_2s30g,,,,gffpv3,True,,HuntHitlersGenitals,,19,True,all_ads,False,[],False,,/r/AskMen/comments/gffpv3/how_do_i_stop_a_girl_from_getting_touchy_with_me/,all_ads,False,https://www.reddit.com/r/AskMen/comments/gffpv3/how_do_i_stop_a_girl_from_getting_touchy_with_me/,1884565,1588887167.0,0,,False,
,AskMen,,t2_3dy82p3b,False,,0,False,What's the most smoothest way you've asked for a person's contact?,[],r/AskMen,False,6,,0,False,t3_gffgbr,False,dark,0.5,,public,0,0,{},,False,[],,False,False,,{},,False,0,,True,,False,,[],{},,True,,1588915113.0,text,6,,,text,self.AskMen,False,,,,,,False,True,False,False,False,[],[],False,False,False,False,,[],False,,,,t5_2s30g,,,,gffgbr,True,,howispendmyday,,5,True,all_ads,False,[],False,,/r/AskMen/comments/gffgbr/whats_the_most_smoothest_way_youve_asked_for_a/,all_ads,False,https://www.reddit.com/r/AskMen/comments/gffgbr/whats_the_most_smoothest_way_youve_asked_for_a/,1884565,1588886313.0,0,,False,
,AskMen,,t2_62hnw4x3,False,,0,False,What's your favourite place to buy clothes online?,[],r/AskMen,False,6,,0,False,t3_gfffgk,False,dark,0.33,,public,0,0,{},,False,[],,False,False,,{},,False,0,,False,,False,,[],{},,True,,1588915040.0,text,6,,,text,self.AskMen,False,,,,,,False,True,False,False,False,[],[],False,False,False,False,,[],False,,,,t5_2s30g,,,,gfffgk,True,,CephiedVariable,,6,True,all_ads,False,[],False,,/r/AskMen/comments/gfffgk/whats_your_favourite_place_to_buy_clothes_online/,all_ads,False,https://www.reddit.com/r/AskMen/comments/gfffgk/whats_your_favourite_place_to_buy_clothes_online/,1884565,1588886240.0,0,,False,
