approved_at_utc,subreddit,selftext,author_fullname,saved,mod_reason_title,gilded,clicked,title,link_flair_richtext,subreddit_name_prefixed,hidden,pwls,link_flair_css_class,downs,hide_score,name,quarantine,link_flair_text_color,upvote_ratio,author_flair_background_color,subreddit_type,ups,total_awards_received,media_embed,author_flair_template_id,is_original_content,user_reports,secure_media,is_reddit_media_domain,is_meta,category,secure_media_embed,link_flair_text,can_mod_post,score,approved_by,author_premium,thumbnail,edited,author_flair_css_class,author_flair_richtext,gildings,content_categories,is_self,mod_note,created,link_flair_type,wls,removed_by_category,banned_by,author_flair_type,domain,allow_live_comments,selftext_html,likes,suggested_sort,banned_at_utc,view_count,archived,no_follow,is_crosspostable,pinned,over_18,all_awardings,awarders,media_only,can_gild,spoiler,locked,author_flair_text,treatment_tags,visited,removed_by,num_reports,distinguished,subreddit_id,mod_reason_by,removal_reason,link_flair_background_color,id,is_robot_indexable,report_reasons,author,discussion_type,num_comments,send_replies,whitelist_status,contest_mode,mod_reports,author_patreon_flair,author_flair_text_color,permalink,parent_whitelist_status,stickied,url,subreddit_subscribers,created_utc,num_crossposts,media,is_video,link_flair_template_id
,AskMen,,t2_171srb,False,,0,False,What are little things women do that make you notice them more?,[],r/AskMen,False,6,,0,False,t3_gfqk6r,False,dark,0.57,,public,1,0,{},,False,[],,False,False,,{},,False,1,,False,,False,,[],{},,True,,1588961752.0,text,6,,,text,self.AskMen,False,,,,,,False,True,False,False,False,[],[],False,False,False,False,,[],False,,,,t5_2s30g,,,,gfqk6r,True,,QueenSolitude,,20,True,all_ads,False,[],False,,/r/AskMen/comments/gfqk6r/what_are_little_things_women_do_that_make_you/,all_ads,False,https://www.reddit.com/r/AskMen/comments/gfqk6r/what_are_little_things_women_do_that_make_you/,1884565,1588932952.0,0,,False,
,AskMen,"I feel like crying a little these days but can't quite do it. If I focus on the feeling it tends to go away, music helps a bit but it's not enough. Any tips and tricks ?",t2_54rfvun7,False,,0,False,How do you cry ?,[],r/AskMen,False,6,,0,False,t3_gfqk52,False,dark,0.56,,public,1,0,{},,False,[],,False,False,,{},,False,1,,False,,False,,[],{},,True,,1588961743.0,text,6,,,text,self.AskMen,False,"&lt;!-- SC_OFF --&gt;&lt;div class=""md""&gt;&lt;p&gt;I feel like crying a little these days but can&amp;#39;t quite do it. If I focus on the feeling it tends to go away, music helps a bit but it&amp;#39;s not enough. Any tips and tricks ?&lt;/p&gt;
&lt;/div&gt;&lt;!-- SC_ON --&gt;",,,,,False,True,False,False,False,[],[],False,False,False,False,,[],False,,,,t5_2s30g,,,,gfqk52,True,,User092347,,18,True,all_ads,False,[],False,,/r/AskMen/comments/gfqk52/how_do_you_cry/,all_ads,False,https://www.reddit.com/r/AskMen/comments/gfqk52/how_do_you_cry/,1884565,1588932943.0,0,,False,
,AskMen,"i'm just really curious,,,",t2_4rnst1wt,False,,0,False,Which kind of titties do you prefer?,[],r/AskMen,False,6,,0,False,t3_gfqjvm,False,dark,0.5,,public,0,0,{},,False,[],,False,False,,{},,False,0,,False,,False,,[],{},,True,,1588961707.0,text,6,,,text,self.AskMen,False,"&lt;!-- SC_OFF --&gt;&lt;div class=""md""&gt;&lt;p&gt;i&amp;#39;m just really curious,,,&lt;/p&gt;
&lt;/div&gt;&lt;!-- SC_ON --&gt;",,,,,False,True,False,False,False,[],[],False,False,False,False,,[],False,,,,t5_2s30g,,,,gfqjvm,True,,gcfjeons,,61,True,all_ads,False,[],False,,/r/AskMen/comments/gfqjvm/which_kind_of_titties_do_you_prefer/,all_ads,False,https://www.reddit.com/r/AskMen/comments/gfqjvm/which_kind_of_titties_do_you_prefer/,1884565,1588932907.0,0,,False,
,AskMen,How to be less anxious about a mistake you have done now but may arise later in your life,t2_5csxsv35,False,,0,False,How to be not scared of future in which something bad may or may not happen,[],r/AskMen,False,6,,0,False,t3_gfqaoo,False,dark,0.86,,public,5,0,{},,False,[],,False,False,,{},,False,5,,False,,False,,[],{},,True,,1588960479.0,text,6,,,text,self.AskMen,False,"&lt;!-- SC_OFF --&gt;&lt;div class=""md""&gt;&lt;p&gt;How to be less anxious about a mistake you have done now but may arise later in your life&lt;/p&gt;
&lt;/div&gt;&lt;!-- SC_ON --&gt;",,,,,False,True,False,False,False,[],[],False,False,False,False,,[],False,,,,t5_2s30g,,,,gfqaoo,True,,getsugaaa77,,25,True,all_ads,False,[],False,,/r/AskMen/comments/gfqaoo/how_to_be_not_scared_of_future_in_which_something/,all_ads,False,https://www.reddit.com/r/AskMen/comments/gfqaoo/how_to_be_not_scared_of_future_in_which_something/,1884565,1588931679.0,0,,False,
,AskMen,,t2_6bf3k20v,False,,0,False,What are the best bodyweight exercises to try at home for building strength?,[],r/AskMen,False,6,,0,False,t3_gfq5m5,False,dark,0.8,,public,13,0,{},,False,[],,False,False,,{},,False,13,,False,,False,,[],{},,True,,1588959784.0,text,6,,,text,self.AskMen,False,,,,,,False,False,False,False,False,[],[],False,False,False,False,,[],False,,,,t5_2s30g,,,,gfq5m5,True,,tatehiles,,42,True,all_ads,False,[],False,,/r/AskMen/comments/gfq5m5/what_are_the_best_bodyweight_exercises_to_try_at/,all_ads,False,https://www.reddit.com/r/AskMen/comments/gfq5m5/what_are_the_best_bodyweight_exercises_to_try_at/,1884565,1588930984.0,0,,False,
,AskMen,"Moving in in about 2 months, just curious.",t2_5gvn1hev,False,,0,False,"Men of Reddit, what are things that changed in your relationship after moving in with your SO?",[],r/AskMen,False,6,,0,False,t3_gfq149,False,dark,0.86,,public,10,0,{},,False,[],,False,False,,{},,False,10,,False,,False,,[],{},,True,,1588959172.0,text,6,,,text,self.AskMen,False,"&lt;!-- SC_OFF --&gt;&lt;div class=""md""&gt;&lt;p&gt;Moving in in about 2 months, just curious.&lt;/p&gt;
&lt;/div&gt;&lt;!-- SC_ON --&gt;",,,,,False,False,False,False,False,[],[],False,False,False,False,,[],False,,,,t5_2s30g,,,,gfq149,True,,palkiewalk,,23,True,all_ads,False,[],False,,/r/AskMen/comments/gfq149/men_of_reddit_what_are_things_that_changed_in/,all_ads,False,https://www.reddit.com/r/AskMen/comments/gfq149/men_of_reddit_what_are_things_that_changed_in/,1884565,1588930372.0,0,,False,
,AskMen,,t2_5pyffzgr,False,,0,False,"Men, if your ex-wife threw herself before you and begged you for forgiveness, would you be willing to get back with her? Why or why not?",[],r/AskMen,False,6,,0,False,t3_gfpvwk,False,dark,0.43,,public,0,0,{},,False,[],,False,False,,{},,False,0,,False,,False,,[],{},,True,,1588958462.0,text,6,,,text,self.AskMen,False,,,,,,False,True,False,False,False,[],[],False,False,False,False,,[],False,,,,t5_2s30g,,,,gfpvwk,True,,Illidan_Stormrage4,,24,True,all_ads,False,[],False,,/r/AskMen/comments/gfpvwk/men_if_your_exwife_threw_herself_before_you_and/,all_ads,False,https://www.reddit.com/r/AskMen/comments/gfpvwk/men_if_your_exwife_threw_herself_before_you_and/,1884565,1588929662.0,0,,False,
,AskMen,,t2_659mm1s9,False,,0,False,:p What are some red flags you should look for in YOURSELF before you enter the dating scene?,[],r/AskMen,False,6,,0,False,t3_gfpvsl,False,dark,0.85,,public,44,0,{},,False,[],,False,False,,{},,False,44,,True,,False,,[],{},,True,,1588958446.0,text,6,,,text,self.AskMen,False,,,,,,False,False,False,False,False,[],[],False,False,False,False,,[],False,,,,t5_2s30g,,,,gfpvsl,True,,araf0123,,33,True,all_ads,False,[],False,,/r/AskMen/comments/gfpvsl/p_what_are_some_red_flags_you_should_look_for_in/,all_ads,False,https://www.reddit.com/r/AskMen/comments/gfpvsl/p_what_are_some_red_flags_you_should_look_for_in/,1884565,1588929646.0,0,,False,
,AskMen,,t2_3e4b7ihz,False,,0,False,How do you know if you are truly interested in a girl and vice versa?,[],r/AskMen,False,6,,0,False,t3_gfpo9g,False,dark,0.74,,public,7,0,{},,False,[],,False,False,,{},,False,7,,False,,False,,[],{},,True,,1588957410.0,text,6,,,text,self.AskMen,False,,,,,,False,True,False,False,False,[],[],False,False,False,False,,[],False,,,,t5_2s30g,,,,gfpo9g,True,,MrSpankyMemeMachine,,13,True,all_ads,False,[],False,,/r/AskMen/comments/gfpo9g/how_do_you_know_if_you_are_truly_interested_in_a/,all_ads,False,https://www.reddit.com/r/AskMen/comments/gfpo9g/how_do_you_know_if_you_are_truly_interested_in_a/,1884565,1588928610.0,0,,False,
,AskMen,"I read this article and it  got me thinking:
https://www.scientificamerican.com/article/men-and-women-cant-be-just-friends/",t2_3i7nxtfr,False,,0,False,"Men of Reddit, what is your stance on just how genuine the ""platonic"" component is of ""platonic"" friendships in your life?",[],r/AskMen,False,6,,0,False,t3_gfpnmu,False,dark,0.72,,public,3,0,{},,False,[],,False,False,,{},,False,3,,False,,False,,[],{},,True,,1588957328.0,text,6,,,text,self.AskMen,False,"&lt;!-- SC_OFF --&gt;&lt;div class=""md""&gt;&lt;p&gt;I read this article and it  got me thinking:
&lt;a href=""https://www.scientificamerican.com/article/men-and-women-cant-be-just-friends/""&gt;https://www.scientificamerican.com/article/men-and-women-cant-be-just-friends/&lt;/a&gt;&lt;/p&gt;
&lt;/div&gt;&lt;!-- SC_ON --&gt;",,,,,False,False,False,False,False,[],[],False,False,False,False,,[],False,,,,t5_2s30g,,,,gfpnmu,True,,bittersweet311,,12,True,all_ads,False,[],False,,/r/AskMen/comments/gfpnmu/men_of_reddit_what_is_your_stance_on_just_how/,all_ads,False,https://www.reddit.com/r/AskMen/comments/gfpnmu/men_of_reddit_what_is_your_stance_on_just_how/,1884565,1588928528.0,0,,False,
,AskMen,"I(23) had a short term girlfriend 7 years ago, we dated about 6 months and my family/parents maybe saw her 20 days in total during that time, because it was a long distance relationship. It didn't work out  and I ended things.

Currently I have an amazing girlfriend for the past 6 years and still going strong, however my family keeps bringing up that ex to the point that it gets a bit annoying/awkward for her as well as for me. I privately told them to stop, but they don't see why it's wrong/annoying.

I'm 100% sure that my family likes my current girlfriend, but this kinda makes her feel 2nd best.

So any other guys with a similar experience and/or how would you handle the problem?

Edit: Thanks for the insight guys will definitely tell them to drop it and elaborate why it's disrespectful. If they don't listen I won't visit.",t2_5gvn1hev,False,,0,False,How do you guys handle family bringing up your ex again and again?,[],r/AskMen,False,6,,0,False,t3_gfpe8a,False,dark,1.0,,public,10,0,{},,False,[],,False,False,,{},,False,10,,False,,1588929983.0,,[],{},,True,,1588956012.0,text,6,,,text,self.AskMen,False,"&lt;!-- SC_OFF --&gt;&lt;div class=""md""&gt;&lt;p&gt;I(23) had a short term girlfriend 7 years ago, we dated about 6 months and my family/parents maybe saw her 20 days in total during that time, because it was a long distance relationship. It didn&amp;#39;t work out  and I ended things.&lt;/p&gt;

&lt;p&gt;Currently I have an amazing girlfriend for the past 6 years and still going strong, however my family keeps bringing up that ex to the point that it gets a bit annoying/awkward for her as well as for me. I privately told them to stop, but they don&amp;#39;t see why it&amp;#39;s wrong/annoying.&lt;/p&gt;

&lt;p&gt;I&amp;#39;m 100% sure that my family likes my current girlfriend, but this kinda makes her feel 2nd best.&lt;/p&gt;

&lt;p&gt;So any other guys with a similar experience and/or how would you handle the problem?&lt;/p&gt;

&lt;p&gt;Edit: Thanks for the insight guys will definitely tell them to drop it and elaborate why it&amp;#39;s disrespectful. If they don&amp;#39;t listen I won&amp;#39;t visit.&lt;/p&gt;
&lt;/div&gt;&lt;!-- SC_ON --&gt;",,,,,False,False,False,False,False,[],[],False,False,False,False,,[],False,,,,t5_2s30g,,,,gfpe8a,True,,palkiewalk,,22,True,all_ads,False,[],False,,/r/AskMen/comments/gfpe8a/how_do_you_guys_handle_family_bringing_up_your_ex/,all_ads,False,https://www.reddit.com/r/AskMen/comments/gfpe8a/how_do_you_guys_handle_family_bringing_up_your_ex/,1884565,1588927212.0,0,,False,
,AskMen,,t2_6ajah9yo,False,,0,False,How often do you argue/ fight with your significant other?,[],r/AskMen,False,6,,0,False,t3_gfp83q,False,dark,0.81,,public,3,0,{},,False,[],,False,False,,{},,False,3,,False,,False,,[],{},,True,,1588955163.0,text,6,,,text,self.AskMen,False,,,,,,False,True,False,False,False,[],[],False,False,False,False,,[],False,,,,t5_2s30g,,,,gfp83q,True,,jaj0908,,11,True,all_ads,False,[],False,,/r/AskMen/comments/gfp83q/how_often_do_you_argue_fight_with_your/,all_ads,False,https://www.reddit.com/r/AskMen/comments/gfp83q/how_often_do_you_argue_fight_with_your/,1884565,1588926363.0,0,,False,
,AskMen,Today my boyfriend told me that one of the things he appreciates most about me was that I apologize when I’ve made a mistake. What are some other things that you wish you could hear more of every day?,t2_66lxng8f,False,,0,False,What are some simple things that you don’t see or hear enough of each day?,[],r/AskMen,False,6,,0,False,t3_gfoyny,False,dark,0.85,,public,13,0,{},,False,[],,False,False,,{},,False,13,,False,,False,,[],{},,True,,1588953866.0,text,6,,,text,self.AskMen,False,"&lt;!-- SC_OFF --&gt;&lt;div class=""md""&gt;&lt;p&gt;Today my boyfriend told me that one of the things he appreciates most about me was that I apologize when I’ve made a mistake. What are some other things that you wish you could hear more of every day?&lt;/p&gt;
&lt;/div&gt;&lt;!-- SC_ON --&gt;",,,,,False,False,False,False,False,[],[],False,False,False,False,,[],False,,,,t5_2s30g,,,,gfoyny,True,,BeePeaceful,,16,True,all_ads,False,[],False,,/r/AskMen/comments/gfoyny/what_are_some_simple_things_that_you_dont_see_or/,all_ads,False,https://www.reddit.com/r/AskMen/comments/gfoyny/what_are_some_simple_things_that_you_dont_see_or/,1884565,1588925066.0,0,,False,
,AskMen,,t2_5k3f2rex,False,,0,False,Where do you take your girlfriend on a date when there’s nothing interesting and fun in the town?,[],r/AskMen,False,6,,0,False,t3_gfou5o,False,dark,0.86,,public,38,0,{},,False,[],,False,False,,{},,False,38,,False,,False,,[],{},,True,,1588953255.0,text,6,,,text,self.AskMen,False,,,,,,False,False,False,False,False,[],[],False,False,False,False,,[],False,,,,t5_2s30g,,,,gfou5o,True,,jadenclueless,,43,True,all_ads,False,[],False,,/r/AskMen/comments/gfou5o/where_do_you_take_your_girlfriend_on_a_date_when/,all_ads,False,https://www.reddit.com/r/AskMen/comments/gfou5o/where_do_you_take_your_girlfriend_on_a_date_when/,1884565,1588924455.0,0,,False,
,AskMen,"I'm 28.

TC 330 at FAANG. Went full remote last year. I travel a lot. I have no....real desire for anything else. I work out a lot. I used to try dating but at five foot three and with a fairly social disability that's not going to happen. 

I tried a bunch of hobbies but none really took, I always ended up back on a plane, reading a book, or playing on the computer but never really talked to other people. 

I'm actually not bragging even if it might sound like because I just...really hate my life.",t2_3p0ightt,False,,0,False,What do you do when you accomplished what you wanted but don't really feel anything and have no more goals?,[],r/AskMen,False,6,,0,False,t3_gfoepe,False,dark,0.93,,public,11,0,{},,False,[],,False,False,,{},,False,11,,False,,False,,[],{},,True,,1588951069.0,text,6,,,text,self.AskMen,False,"&lt;!-- SC_OFF --&gt;&lt;div class=""md""&gt;&lt;p&gt;I&amp;#39;m 28.&lt;/p&gt;

&lt;p&gt;TC 330 at FAANG. Went full remote last year. I travel a lot. I have no....real desire for anything else. I work out a lot. I used to try dating but at five foot three and with a fairly social disability that&amp;#39;s not going to happen. &lt;/p&gt;

&lt;p&gt;I tried a bunch of hobbies but none really took, I always ended up back on a plane, reading a book, or playing on the computer but never really talked to other people. &lt;/p&gt;

&lt;p&gt;I&amp;#39;m actually not bragging even if it might sound like because I just...really hate my life.&lt;/p&gt;
&lt;/div&gt;&lt;!-- SC_ON --&gt;",,,,,False,True,False,False,False,[],[],False,False,False,False,,[],False,,,,t5_2s30g,,,,gfoepe,True,,ConnectTryQuestions,,10,True,all_ads,False,[],False,,/r/AskMen/comments/gfoepe/what_do_you_do_when_you_accomplished_what_you/,all_ads,False,https://www.reddit.com/r/AskMen/comments/gfoepe/what_do_you_do_when_you_accomplished_what_you/,1884565,1588922269.0,0,,False,
,AskMen,"Just a newly 18 guy wondering if i’m normal or not. It’s kind of stressful thinking about growing up, and having to go to college and then a love life on top of that. Life is scary man",t2_13cjxe,False,,0,False,How long did it take for you guys to get into a serious relationship?,[],r/AskMen,False,6,,0,False,t3_gfo7ce,False,dark,0.81,,public,3,0,{},,False,[],,False,False,,{},,False,3,,False,,False,,[],{},,True,,1588950048.0,text,6,,,text,self.AskMen,False,"&lt;!-- SC_OFF --&gt;&lt;div class=""md""&gt;&lt;p&gt;Just a newly 18 guy wondering if i’m normal or not. It’s kind of stressful thinking about growing up, and having to go to college and then a love life on top of that. Life is scary man&lt;/p&gt;
&lt;/div&gt;&lt;!-- SC_ON --&gt;",,,,,False,True,False,False,False,[],[],False,False,False,False,,[],False,,,,t5_2s30g,,,,gfo7ce,True,,AuFish34,,10,True,all_ads,False,[],False,,/r/AskMen/comments/gfo7ce/how_long_did_it_take_for_you_guys_to_get_into_a/,all_ads,False,https://www.reddit.com/r/AskMen/comments/gfo7ce/how_long_did_it_take_for_you_guys_to_get_into_a/,1884565,1588921248.0,0,,False,
,AskMen,"So I am planning on moving to BC, Vancouver for work (When the pandemic is over of course) and I really want to get my body into shape and learn how to fight just in case I need to, What's good places to learn? Mauy Tai, Martial Arts, Boxing, etc what's the best one? Please give me all the information.",t2_kwj6l,False,,0,False,"Planning on moving to Vancouver, best place how to learn how to fight?",[],r/AskMen,False,6,,0,False,t3_gfo2oh,False,dark,0.5,,public,0,0,{},,False,[],,False,False,,{},,False,0,,False,,False,,[],{},,True,,1588949381.0,text,6,,,text,self.AskMen,False,"&lt;!-- SC_OFF --&gt;&lt;div class=""md""&gt;&lt;p&gt;So I am planning on moving to BC, Vancouver for work (When the pandemic is over of course) and I really want to get my body into shape and learn how to fight just in case I need to, What&amp;#39;s good places to learn? Mauy Tai, Martial Arts, Boxing, etc what&amp;#39;s the best one? Please give me all the information.&lt;/p&gt;
&lt;/div&gt;&lt;!-- SC_ON --&gt;",,,,,False,True,False,False,False,[],[],False,False,False,False,,[],False,,,,t5_2s30g,,,,gfo2oh,True,,Meelow100,,7,True,all_ads,False,[],False,,/r/AskMen/comments/gfo2oh/planning_on_moving_to_vancouver_best_place_how_to/,all_ads,False,https://www.reddit.com/r/AskMen/comments/gfo2oh/planning_on_moving_to_vancouver_best_place_how_to/,1884565,1588920581.0,0,,False,
,AskMen,"I often hear men say ""I belong in a different time"" so what time would that be and why? What would you be or do?

Plus I've been watching the last kingdom recently and feel like it was much simpler times.",t2_66yyjomh,False,,0,False,What time do you belong in?,[],r/AskMen,False,6,,0,False,t3_gfnuuk,False,dark,0.86,,public,10,0,{},,False,[],,False,False,,{},,False,10,,False,,1588920202.0,,[],{},,True,,1588948299.0,text,6,,,text,self.AskMen,False,"&lt;!-- SC_OFF --&gt;&lt;div class=""md""&gt;&lt;p&gt;I often hear men say &amp;quot;I belong in a different time&amp;quot; so what time would that be and why? What would you be or do?&lt;/p&gt;

&lt;p&gt;Plus I&amp;#39;ve been watching the last kingdom recently and feel like it was much simpler times.&lt;/p&gt;
&lt;/div&gt;&lt;!-- SC_ON --&gt;",,,,,False,False,False,False,False,[],[],False,False,False,False,,[],False,,,,t5_2s30g,,,,gfnuuk,True,,Tank3vans,,56,True,all_ads,False,[],False,,/r/AskMen/comments/gfnuuk/what_time_do_you_belong_in/,all_ads,False,https://www.reddit.com/r/AskMen/comments/gfnuuk/what_time_do_you_belong_in/,1884565,1588919499.0,0,,False,
,AskMen,Or any advice you were given that helped you?,t2_3599qan8,False,,0,False,There are many books / quotes about self love/ loving and accept others as well as yourself for women. What are some books/ pages/ quotes like these for men?,[],r/AskMen,False,6,,0,False,t3_gfnokb,False,dark,0.67,,public,2,0,{},,False,[],,False,False,,{},,False,2,,False,,False,,[],{},,True,,1588947402.0,text,6,,,text,self.AskMen,False,"&lt;!-- SC_OFF --&gt;&lt;div class=""md""&gt;&lt;p&gt;Or any advice you were given that helped you?&lt;/p&gt;
&lt;/div&gt;&lt;!-- SC_ON --&gt;",,,,,False,True,False,False,False,[],[],False,False,False,False,,[],False,,,,t5_2s30g,,,,gfnokb,True,,wildchild7_,,19,True,all_ads,False,[],False,,/r/AskMen/comments/gfnokb/there_are_many_books_quotes_about_self_love/,all_ads,False,https://www.reddit.com/r/AskMen/comments/gfnokb/there_are_many_books_quotes_about_self_love/,1884565,1588918602.0,0,,False,
,AskMen,"Not just looks, but “Takes care of the home” “Makes dinner” etc?",t2_2rtjtq53,False,,0,False,How would you describe your perfect wife?,[],r/AskMen,False,6,,0,False,t3_gfnlf4,False,dark,0.77,,public,7,0,{},,False,[],,False,False,,{},,False,7,,False,,False,,[],{},,True,,1588946960.0,text,6,,,text,self.AskMen,False,"&lt;!-- SC_OFF --&gt;&lt;div class=""md""&gt;&lt;p&gt;Not just looks, but “Takes care of the home” “Makes dinner” etc?&lt;/p&gt;
&lt;/div&gt;&lt;!-- SC_ON --&gt;",,,,,False,True,False,False,False,[],[],False,False,False,False,,[],False,,,,t5_2s30g,,,,gfnlf4,True,,KoraaaM,,20,True,all_ads,False,[],False,,/r/AskMen/comments/gfnlf4/how_would_you_describe_your_perfect_wife/,all_ads,False,https://www.reddit.com/r/AskMen/comments/gfnlf4/how_would_you_describe_your_perfect_wife/,1884565,1588918160.0,0,,False,
,AskMen,"Hi there, first time on this subreddit. Currently in a relationship and my girlfriend has always been worried about how she looks to others or how she acts. She has the constant belief that she is ""dumb"" or ""ugly"" even though that really isn't the case at all. I am as supportive as it gets and compliment her whenever I can. But I really just want her to be **more** comfortable with being herself. What's the best advice?",t2_1yl12n0y,False,,0,False,How do you make your partner more comfortable with their self esteem/self worth?,[],r/AskMen,False,6,,0,False,t3_gfnjs7,False,dark,0.71,,public,4,0,{},,False,[],,False,False,,{},,False,4,,False,,False,,[],{},,True,,1588946738.0,text,6,,,text,self.AskMen,False,"&lt;!-- SC_OFF --&gt;&lt;div class=""md""&gt;&lt;p&gt;Hi there, first time on this subreddit. Currently in a relationship and my girlfriend has always been worried about how she looks to others or how she acts. She has the constant belief that she is &amp;quot;dumb&amp;quot; or &amp;quot;ugly&amp;quot; even though that really isn&amp;#39;t the case at all. I am as supportive as it gets and compliment her whenever I can. But I really just want her to be &lt;strong&gt;more&lt;/strong&gt; comfortable with being herself. What&amp;#39;s the best advice?&lt;/p&gt;
&lt;/div&gt;&lt;!-- SC_ON --&gt;",,,,,False,True,False,False,False,[],[],False,False,False,False,,[],False,,,,t5_2s30g,,,,gfnjs7,True,,averagebowlofpho,,9,True,all_ads,False,[],False,,/r/AskMen/comments/gfnjs7/how_do_you_make_your_partner_more_comfortable/,all_ads,False,https://www.reddit.com/r/AskMen/comments/gfnjs7/how_do_you_make_your_partner_more_comfortable/,1884565,1588917938.0,0,,False,
,AskMen,,t2_2zpfp5nz,False,,0,False,Why do TV shows/movies often portray men falling for bad women?,[],r/AskMen,False,6,,0,False,t3_gfnhsl,False,dark,0.78,,public,5,0,{},,False,[],,False,False,,{},,False,5,,False,,False,,[],{},,True,,1588946472.0,text,6,,,text,self.AskMen,False,,,,,,False,False,False,False,False,[],[],False,False,False,False,,[],False,,,,t5_2s30g,,,,gfnhsl,True,,wisdom_is_gold,,12,True,all_ads,False,[],False,,/r/AskMen/comments/gfnhsl/why_do_tv_showsmovies_often_portray_men_falling/,all_ads,False,https://www.reddit.com/r/AskMen/comments/gfnhsl/why_do_tv_showsmovies_often_portray_men_falling/,1884565,1588917672.0,0,,False,
,AskMen,I'm really insecure and would like to know your experiences when dating such partners.,t2_5wmvs1sj,False,,0,False,"Men of Reddit, how do you deal with a low self-esteemed partner?",[],r/AskMen,False,6,,0,False,t3_gfn8pw,False,dark,0.93,,public,110,0,{},,False,[],,False,False,,{},,False,110,,False,,False,,[],{},,True,,1588945190.0,text,6,,,text,self.AskMen,False,"&lt;!-- SC_OFF --&gt;&lt;div class=""md""&gt;&lt;p&gt;I&amp;#39;m really insecure and would like to know your experiences when dating such partners.&lt;/p&gt;
&lt;/div&gt;&lt;!-- SC_ON --&gt;",,,,,False,False,False,False,False,[],[],False,False,False,False,,[],False,,,,t5_2s30g,,,,gfn8pw,True,,_little_bee,,78,True,all_ads,False,[],False,,/r/AskMen/comments/gfn8pw/men_of_reddit_how_do_you_deal_with_a_low/,all_ads,False,https://www.reddit.com/r/AskMen/comments/gfn8pw/men_of_reddit_how_do_you_deal_with_a_low/,1884565,1588916390.0,0,,False,
